"id","description","vendor","product","IoT_class"
"CVE-2022-32259","A vulnerability has been identified in SINEMA Remote Connect Server (All versions < V3.1). The system images for installation or update of the affected application contain unit test scripts with sensitive information. An attacker could gain information about testing architecture and also tamper with test configuration.","Siemens","SINEMA Remote Connect Server","SCADA"
"CVE-2019-4640","IBM Security Secret Server 10.7 processes patches, image backups and other updates without sufficiently verifying the origin and integrity of the code which could result in an attacker executing malicious code. IBM X-Force ID: 170046.","IBM","Security Secret Server","Enterprise"
"CVE-2022-38101","Uncontrolled search path in some Intel(R) NUC Chaco Canyon BIOS update software before version iFlashV Windows 5.13.00.2105 may allow an authenticated user to potentially enable escalation of privilege via local access.","n/a","Intel(R) NUC Chaco Canyon BIOS update software","PC"
"CVE-2019-1880","A vulnerability in the BIOS upgrade utility of Cisco Unified Computing System (UCS) C-Series Rack Servers could allow an authenticated, local attacker to install compromised BIOS firmware on an affected device. The vulnerability is due to insufficient validation of the firmware image file. An attacker could exploit this vulnerability by executing the BIOS upgrade utility with a specific set of options. A successful exploit could allow the attacker to bypass the firmware signature-verification process and install compromised BIOS firmware on an affected device.","Cisco","Cisco Unified Computing System (Managed)","Enterprise"
"CVE-2025-57804","h2 is a pure-Python implementation of a HTTP/2 protocol stack. Prior to version 4.3.0, an HTTP/2 request splitting vulnerability allows attackers to perform request smuggling attacks by injecting CRLF characters into headers. This occurs when servers downgrade HTTP/2 requests to HTTP/1.1 without properly validating header names/values, enabling attackers to manipulate request boundaries and bypass security controls. This issue has been patched in version 4.3.0.","python-hyper","h2","Other"
"CVE-2022-38625","Patlite NH-FB v1.46 and below was discovered to contain insufficient firmware validation during the upgrade firmware file upload process. This vulnerability allows authenticated attackers to create and upload their own custom-built firmware and inject malicious code. NOTE: the vendor's position is that this is a design choice, not a vulnerability","n/a","n/a","Other"
"CVE-2025-43522","A downgrade issue affecting Intel-based Mac computers was addressed with additional code-signing restrictions. This issue is fixed in macOS Tahoe 26.2, macOS Sequoia 15.7.3. An app may be able to access user-sensitive data.","Apple","macOS","PC"
"CVE-2023-45779","In the APEX module framework of AOSP, there is a possible malicious update to platform components due to improperly used crypto. This could lead to local escalation of privilege with no additional execution privileges needed. User interaction is not needed for exploitation. More details on this can be found in the referenced links. ","Google","Android","Home"
"CVE-2024-52537","Dell Client Platform Firmware Update Utility contains an Improper Link Resolution vulnerability. A high privileged attacker with local access could potentially exploit this vulnerability, leading to Elevation of Privileges.","Dell","Dell Client Platform BIOS","Enterprise"
"CVE-2020-0996","An elevation of privilege vulnerability exists when the Windows Update Stack fails to properly handle objects in memory, aka 'Windows Update Stack Elevation of Privilege Vulnerability'. This CVE ID is unique from CVE-2020-0985.","Microsoft","Windows","PC"
"CVE-2018-19234","The Miss Marple Updater Service in COMPAREX Miss Marple Enterprise Edition before 2.0 allows remote attackers to execute arbitrary code with SYSTEM privileges via vectors related to missing update validation.","n/a","n/a","Other"
"CVE-2024-12577","Kernel software installed and running inside a Guest VM may exploit memory shared with the GPU Firmware to write data outside the Guest's virtualised GPU memory.","Imagination Technologies","Graphics DDK","SCADA"
"CVE-2020-2032","A race condition vulnerability Palo Alto Networks GlobalProtect app on Windows allows a local limited Windows user to execute programs with SYSTEM privileges. This issue can be exploited only while performing a GlobalProtect app upgrade. This issue affects: GlobalProtect app 5.0 versions earlier than GlobalProtect app 5.0.10 on Windows; GlobalProtect app 5.1 versions earlier than GlobalProtect app 5.1.4 on Windows.","Palo Alto Networks","GlobalProtect App","PC"
"CVE-2024-36282","Improper input validation in the Intel(R) Server Board S2600ST Family BIOS and Firmware Update software all versions may allow a privileged user to potentially enable escalation of privilege via local access.","n/a","Intel(R) Server Board S2600ST Family BIOS and Firmware Update software","PC"
"CVE-2017-8665","The Xamarin.iOS update component on systems running macOS allows an attacker to run arbitrary code as root, aka ""Xamarin.iOS Elevation Of Privilege Vulnerability.""","Microsoft Corporation","Xamarin.iOS","PC"
"CVE-2022-25291","An integer overflow in WatchGuard Firebox and XTM appliances allows an authenticated remote attacker to trigger a heap-based buffer overflow and potentially execute arbitrary code by initiating a firmware update with a malicious upgrade image. This vulnerability impacts Fireware OS before 12.7.2_U2, 12.x before 12.1.3_U8, and 12.2.x through 12.5.x before 12.5.9_U2.","n/a","n/a","Other"
"CVE-2021-36021","Magento versions 2.4.2 (and earlier), 2.4.2-p1 (and earlier) and 2.3.7 (and earlier) are affected by an Improper input validation vulnerability within the CMS page scheduled update feature. An authenticated attacker with administrative privilege could leverage this vulnerability to achieve remote code execution on the system. ","Adobe","Adobe Commerce","Other"
"CVE-2024-48775","An issue in Plug n Play Camera com.ezset.delaney 1.2.0 allows a remote attacker to obtain sensitive information via the firmware update process.","n/a","n/a","Home"
"CVE-2024-52935","Kernel software installed and running inside a Guest VM may exploit memory shared with the GPU Firmware to write data outside the Guest's virtualised GPU memory.","Imagination Technologies","Graphics DDK","SCADA"
"CVE-2021-22790","A CWE-125: Out-of-bounds Read vulnerability that could cause a Denial of Service on the Modicon PLC controller / simulator when updating the controller application with a specially crafted project file exists in Modicon M580 CPU (part numbers BMEP* and BMEH*, all versions), Modicon M340 CPU (part numbers BMXP34*, all versions), Modicon MC80 (part numbers BMKC80*, all versions), Modicon Momentum Ethernet CPU (part numbers 171CBU*, all versions), PLC Simulator for EcoStruxureª Control Expert, including all Unity Pro versions (former name of EcoStruxureª Control Expert, all versions), PLC Simulator for EcoStruxureª Process Expert including all HDCS versions (former name of EcoStruxureª Process Expert, all versions), Modicon Quantum CPU (part numbers 140CPU*, all versions), Modicon Premium CPU (part numbers TSXP5*, all versions).","n/a","Modicon M580 CPU (part numbers BMEP* and BMEH*, all versions), Modicon M340 CPU (part numbers BMXP34*, all versions), Modicon MC80 (part numbers BMKC80*, all versions), Modicon Momentum Ethernet CPU (part numbers 171CBU*, all versions), PLC Simulator for EcoStruxureª Control Expert, including all Unity Pro versions (former name of EcoStruxureª Control Expert, all versions), PLC Simulator for EcoStruxureª Process Expert including all HDCS versions (former name of EcoStruxureª Process Expert, all versions), Modicon Quantum CPU (part numbers 140CPU*, all versions), Modicon Premium CPU (part numbers TSXP5*, all versions)","SCADA"
"CVE-2021-3485","An Improper Input Validation vulnerability in the Product Update feature of Bitdefender Endpoint Security Tools for Linux allows a man-in-the-middle attacker to abuse the DownloadFile function of the Product Update to achieve remote code execution. This issue affects: Bitdefender Endpoint Security Tools for Linux versions prior to 6.2.21.155.","Bitdefender","Endpoint Security Tools for Linux","PC"
"CVE-2021-28191","The Firmware update function in ASUS BMC’s firmware Web management page does not verify the string length entered by users, resulting in a Buffer overflow vulnerability. As obtaining the privileged permission, remote attackers use the leakage to abnormally terminate the Web service.","ASUS","BMC firmware for ASMB9-iKVM","Home"
"CVE-2023-0392","The LDAP Agent Update service with versions prior to 5.18 used an unquoted path, which could allow arbitrary code execution.","Okta","LDAP Agent","Other"
"CVE-2025-54596","Abnormal Security /v1.0/rbac/users_v2/{USER_ID}/ before 2025-02-19 allows downgrading the privileges of other user accounts.","Abnormal AI","Abnormal Security","Other"
"CVE-2020-10831","An issue was discovered on Samsung mobile devices with O(8.x), P(9.0), and Q(10.0) software. Attackers can trigger an update to arbitrary touch-screen firmware. The Samsung ID is SVE-2019-16013 (March 2020).","n/a","n/a","Mobile"
"CVE-2025-29084","SQL Injection vulnerability in CSZ-CMS v.1.3.0 allows a remote attacker to execute arbitrary code via the execSqlFile function in the Upgrade.php file.","n/a","n/a","Other"
"CVE-2018-6221","An unvalidated software update vulnerability in Trend Micro Email Encryption Gateway 5.5 could allow a man-in-the-middle attacker to tamper with an update file and inject their own.","Trend Micro","Trend Micro Email Encryption Gateway","Home"
"CVE-2021-33090","Incorrect default permissionsin the software installer for the Intel(R) NUC HDMI Firmware Update Tool for NUC10i3FN, NUC10i5FN, NUC10i7FN before version 1.78.2.0.7 may allow an authenticated user to potentially enable escalation of privilege via local access.","n/a","Intel(R) NUC HDMI Firmware Update Tool for NUC10i3FN, NUC10i5FN, NUC10i7FN","Other"
"CVE-2025-30199","ECOVACS vacuum robot base stations do not validate firmware updates, so malicious over-the-air updates can be sent to base station via insecure connection between robot and base station.","ECOVACS","DEEBOT X1 Series","Other"
"CVE-2022-34471","When downloading an update for an addon, the downloaded addon update's version was not verified to match the version selected from the manifest. If the manifest had been tampered with on the server, an attacker could trick the browser into downgrading the addon to a prior version. This vulnerability affects Firefox < 102.","Mozilla","Firefox","PC"
"CVE-2023-30702","Stack overflow vulnerability in SSHDCPAPP TA prior to &quot;SAMSUNG ELECTONICS, CO, LTD. - System Hardware Update - 7/13/2023&quot; in Windows Update for Galaxy book Go, Galaxy book Go 5G, Galaxy book2 Go and Galaxy book2 Pro 360 allows local attacker to execute arbitrary code.","Samsung Mobile","Galaxy book Go, Galaxy book Go 5G, Galaxy book2 Go and Galaxy book2 Pro 360","PC"
"CVE-2023-7005","A specially crafted message can be sent to the TTLock App that downgrades the encryption protocol used for communication, and can be utilized to compromise the lock, such as through revealing the unlockKey field.","Sciener","TTLock App","Home"
"CVE-2021-1426","Multiple vulnerabilities in the install, uninstall, and upgrade processes of Cisco AnyConnect Secure Mobility Client for Windows could allow an authenticated, local attacker to hijack DLL or executable files that are used by the application. A successful exploit could allow the attacker to execute arbitrary code on an affected device with SYSTEM privileges. To exploit these vulnerabilities, the attacker must have valid credentials on the Windows system. For more information about these vulnerabilities, see the Details section of this advisory.","Cisco","Cisco AnyConnect Secure Mobility Client","Enterprise"
"CVE-2016-4741","The Assets component in Apple iOS before 10 allows man-in-the-middle attackers to block software updates via vectors related to lack of an HTTPS session for retrieving updates.","n/a","n/a","Mobile"
"CVE-2022-24644","ZZ Inc. KeyMouse Windows 3.08 and prior is affected by a remote code execution vulnerability during an unauthenticated update. To exploit this vulnerability, a user must trigger an update of an affected installation of KeyMouse.","n/a","n/a","PC"
"CVE-2021-46442","In the ""webupg"" binary of D-Link DIR-825 G1, attackers can bypass authentication through parameters ""autoupgrade.asp"", and perform functions such as downloading configuration files and updating firmware without authorization.","n/a","n/a","Home"
"CVE-2021-38634","Microsoft Windows Update Client Elevation of Privilege Vulnerability","Microsoft","Windows 10 Version 1809","PC"
"CVE-2019-7229","The ABB CP635 HMI uses two different transmission methods to upgrade its firmware and its software components: ""Utilization of USB/SD Card to flash the device"" and ""Remote provisioning process via ABB Panel Builder 600 over FTP."" Neither of these transmission methods implements any form of encryption or authenticity checks against the new firmware HMI software binary files.","n/a","n/a","SCADA"
"CVE-2019-1289","An elevation of privilege vulnerability exists when the Windows Update Delivery Optimization does not properly enforce file share permissions, aka 'Windows Update Delivery Optimization Elevation of Privilege Vulnerability'.","Microsoft","Windows","PC"
"CVE-2023-34937","A stack overflow in the UpdateSnat function of H3C Magic B1STV100R012 allows attackers to cause a Denial of Service (DoS) via a crafted POST request.","n/a","n/a","Other"
"CVE-2021-26930","An issue was discovered in the Linux kernel 3.11 through 5.10.16, as used by Xen. To service requests to the PV backend, the driver maps grant references provided by the frontend. In this process, errors may be encountered. In one case, an error encountered earlier might be discarded by later processing, resulting in the caller assuming successful mapping, and hence subsequent operations trying to access space that wasn't mapped. In another case, internal state would be insufficiently updated, preventing safe recovery from the error. This affects drivers/block/xen-blkback/blkback.c.","n/a","n/a","PC"
"CVE-2024-24981","Improper input validation in PfrSmiUpdateFw driver in UEFI firmware for some Intel(R) Server M50FCP Family products may allow a privileged user to enable escalation of privilege via local access.","n/a","UEFI firmware for some Intel(R) Server M50FCP Family products","PC"
"CVE-2019-6742","This vulnerability allows remote attackers to execute arbitrary code on vulnerable installations of Samsung Galaxy S9 prior to 1.4.20.2. Authentication is not required to exploit this vulnerability. The specific flaw exists within the handling of the GameServiceReceiver update mechanism. An attacker can leverage this vulnerability to execute code in the context of the current process. Was ZDI-CAN-7477.","Samsung","Galaxy S9","Home"
"CVE-2023-6321","A command injection vulnerability exists in the IOCTL that manages OTA updates. A specially crafted command can lead to command execution as the root user. An attacker can make authenticated requests to trigger this vulnerability.","Owlet","Cam v2","Other"
"CVE-2023-35749","D-Link DAP-2622 DDP Firmware Upgrade Filename Stack-based Buffer Overflow Remote Code Execution Vulnerability. This vulnerability allows network-adjacent attackers to execute arbitrary code on affected installations of D-Link DAP-2622 routers. Authentication is not required to exploit this vulnerability. The specific flaw exists within the DDP service. The issue results from the lack of proper validation of the length of user-supplied data prior to copying it to a fixed-length stack-based buffer. An attacker can leverage this vulnerability to execute code in the context of root. . Was ZDI-CAN-20077.","D-Link","DAP-2622","Home"
"CVE-2017-6445","The auto-update feature of Open Embedded Linux Entertainment Center (OpenELEC) 6.0.3, 7.0.1, and 8.0.4 uses neither encrypted connections nor signed updates. A man-in-the-middle attacker could manipulate the update packages to gain root access remotely.","n/a","n/a","PC"
"CVE-2019-17190","A Local Privilege Escalation issue was discovered in Avast Secure Browser 76.0.1659.101. The vulnerability is due to an insecure ACL set by the AvastBrowserUpdate.exe (which is running as NT AUTHORITY\SYSTEM) when AvastSecureBrowser.exe checks for new updates. When the update check is triggered, the elevated process cleans the ACL of the Update.ini file in %PROGRAMDATA%\Avast Software\Browser\Update\ and sets all privileges to group Everyone. Because any low-privileged user can create, delete, or modify the Update.ini file stored in this location, an attacker with low privileges can create a hard link named Update.ini in this folder, and make it point to a file writable by NT AUTHORITY\SYSTEM. Once AvastBrowserUpdate.exe is triggered by the update check functionality, the DACL is set to a misconfigured value on the crafted Update.ini and, consequently, to the target file that was previously not writable by the low-privileged attacker.","n/a","n/a","PC"
"CVE-2024-7833","A vulnerability was found in D-Link DI-8100 16.07. It has been classified as critical. This affects the function upgrade_filter_asp of the file upgrade_filter.asp. The manipulation of the argument path leads to command injection. It is possible to initiate the attack remotely. The exploit has been disclosed to the public and may be used.","D-Link","DI-8100","Home"
"CVE-2017-9316","Firmware upgrade authentication bypass vulnerability was found in Dahua IPC-HDW4300S and some IP products. The vulnerability was caused by internal Debug function. This particular function was used for problem analysis and performance tuning during product development phase. It allowed the device to receive only specific data (one direction, no transmit) and therefore it was not involved in any instance of collecting user privacy data or allowing remote code execution.","Dahua Technologies","IPC-HDW4300S\NVR11HS\IPC-HFW4X00\IPC-HDW4X00\IPC-HDBW4X00\IPC-HF5X00\IPC-HFW5X00\IPC-HDW5X00\IPC-HDBW5X00\NVR11HS","PC"
"CVE-2020-3342","A vulnerability in the software update feature of Cisco Webex Meetings Desktop App for Mac could allow an unauthenticated, remote attacker to execute arbitrary code on an affected system. The vulnerability is due to improper validation of cryptographic protections on files that are downloaded by the application as part of a software update. An attacker could exploit this vulnerability by persuading a user to go to a website that returns files to the client that are similar to files that are returned from a valid Webex website. The client may fail to properly validate the cryptographic protections of the provided files before executing them as part of an update. A successful exploit could allow the attacker to execute arbitrary code on the affected system with the privileges of the user.","Cisco","Cisco WebEx Meetings Server","Enterprise"
"CVE-2023-48902","An issue was discovered in tramyardg autoexpress version 1.3.0, allows unauthenticated remote attackers to escalate privileges, update car data, delete vehicles, and upload car images via authentication bypass in uploadCarImages.php.","n/a","n/a","SCADA"
"CVE-2022-20730","A vulnerability in the Security Intelligence feed feature of Cisco Firepower Threat Defense (FTD) Software could allow an unauthenticated, remote attacker to bypass the Security Intelligence DNS feed. This vulnerability is due to incorrect feed update processing. An attacker could exploit this vulnerability by sending traffic through an affected device that should be blocked by the affected device. A successful exploit could allow the attacker to bypass device controls and successfully send traffic to devices that are expected to be protected by the affected device.","Cisco","Cisco Firepower Threat Defense Software","Enterprise"
"CVE-2019-16243","On TCL Alcatel Cingular Flip 2 B9HUAH1 devices, there is an undocumented web API that allows unprivileged JavaScript, including JavaScript running within the KaiOS browser, to view and edit the device's firmware over-the-air update settings. (This web API is normally used by the system application to trigger firmware updates via OmaService.js.)","n/a","n/a","PC"
"CVE-2020-17076","Windows Update Orchestrator Service Elevation of Privilege Vulnerability","Microsoft","Windows 10 Version 1909","PC"
"CVE-2021-3059","An OS command injection vulnerability in the Palo Alto Networks PAN-OS management interface exists when performing dynamic updates. This vulnerability enables a man-in-the-middle attacker to execute arbitrary OS commands to escalate privileges. This issue impacts: PAN-OS 8.1 versions earlier than PAN-OS 8.1.20-h1; PAN-OS 9.0 versions earlier than PAN-OS 9.0.14-h3; PAN-OS 9.1 versions earlier than PAN-OS 9.1.11-h2; PAN-OS 10.0 versions earlier than PAN-OS 10.0.8; PAN-OS 10.1 versions earlier than PAN-OS 10.1.3. Prisma Access customers that have Prisma Access 2.1 Preferred or Prisma Access 2.1 Innovation firewalls are impacted by this issue.","Palo Alto Networks","PAN-OS","Enterprise"
"CVE-2025-24122","A downgrade issue affecting Intel-based Mac computers was addressed with additional code-signing restrictions. This issue is fixed in macOS Ventura 13.7.3, macOS Sequoia 15.3, macOS Sonoma 14.7.3. An app may be able to modify protected parts of the file system.","Apple","macOS","PC"
"CVE-2024-37570","On Mitel 6869i 4.5.0.41 devices, the Manual Firmware Update (upgrade.html) page does not perform sanitization on the username and path parameters (sent by an authenticated user) before appending flags to the busybox ftpget command. This leads to $() command execution.","n/a","n/a","Other"
"CVE-2019-1861","A vulnerability in the software update feature of Cisco Industrial Network Director could allow an authenticated, remote attacker to execute arbitrary code. The vulnerability is due to improper validation of files uploaded to the affected application. An attacker could exploit this vulnerability by authenticating to the affected system using administrator privileges and uploading an arbitrary file. A successful exploit could allow the attacker to execute arbitrary code with elevated privileges.","Cisco","Cisco Industrial Network Director","Enterprise"
"CVE-2025-22366","The authenticated firmware update capability of the firmware for Mennekes Smart / Premium Chargingpoints can be abused for command execution because OS command are improperly neutralized when certain fields are passed to the underlying OS.","Mennekes","Smart / Premium charging stations","SCADA"
"CVE-2025-9379","A vulnerability was determined in Belkin AX1800 1.1.00.016. Affected by this vulnerability is an unknown functionality of the component Firmware Update Handler. This manipulation causes insufficient verification of data authenticity. The attack can be initiated remotely. The vendor was contacted early about this disclosure but did not respond in any way.","Belkin","AX1800","Home"
"CVE-2023-35747","D-Link DAP-2622 DDP Firmware Upgrade Auth Password Stack-based Buffer Overflow Remote Code Execution Vulnerability. This vulnerability allows network-adjacent attackers to execute arbitrary code on affected installations of D-Link DAP-2622 routers. Authentication is not required to exploit this vulnerability. The specific flaw exists within the DDP service. The issue results from the lack of proper validation of the length of user-supplied data prior to copying it to a fixed-length stack-based buffer. An attacker can leverage this vulnerability to execute code in the context of root. . Was ZDI-CAN-20075.","D-Link","DAP-2622","Home"
"CVE-2022-21973","Windows Media Center Update Denial of Service Vulnerability","Microsoft","Windows 7","PC"
"CVE-2025-38386","In the Linux kernel, the following vulnerability has been resolved: ACPICA: Refuse to evaluate a method if arguments are missing As reported in [1], a platform firmware update that increased the number of method parameters and forgot to update a least one of its callers, caused ACPICA to crash due to use-after-free. Since this a result of a clear AML issue that arguably cannot be fixed up by the interpreter (it cannot produce missing data out of thin air), address it by making ACPICA refuse to evaluate a method if the caller attempts to pass fewer arguments than expected to it.","Linux","Linux","PC"
"CVE-2016-9369","An issue was discovered in Moxa NPort 5110 versions prior to 2.6, NPort 5130/5150 Series versions prior to 3.6, NPort 5200 Series versions prior to 2.8, NPort 5400 Series versions prior to 3.11, NPort 5600 Series versions prior to 3.7, NPort 5100A Series & NPort P5150A versions prior to 1.3, NPort 5200A Series versions prior to 1.3, NPort 5150AI-M12 Series versions prior to 1.2, NPort 5250AI-M12 Series versions prior to 1.2, NPort 5450AI-M12 Series versions prior to 1.2, NPort 5600-8-DT Series versions prior to 2.4, NPort 5600-8-DTL Series versions prior to 2.4, NPort 6x50 Series versions prior to 1.13.11, NPort IA5450A versions prior to v1.4. Firmware can be updated over the network without authentication, which may allow remote code execution.","n/a","Moxa NPort","Other"
