"id","description","vendor","product","IoT_class"
"CVE-2017-17023","The Sophos UTM VPN endpoint interacts with client software provided by NPC Engineering (www.ncp-e.com). The affected client software, ""Sophos IPSec Client"" 11.04 is a rebranded version of NCP ""Secure Entry Client"" 10.11 r32792. A vulnerability in the software update feature of the VPN client allows a man-in-the-middle (MITM) or man-on-the-side (MOTS) attacker to execute arbitrary, malicious software on a target user's computer. This is related to SIC_V11.04-64.exe (Sophos), NCP_EntryCl_Windows_x86_1004_31799.exe (NCP), and ncpmon.exe (both Sophos and NCP). The vulnerability exists because: (1) the VPN client requests update metadata over an insecure HTTP connection; and (2) the client software does not check if the software update is signed before running it.","n/a","n/a","Enterprise"
"CVE-2017-7766","An attack using manipulation of ""updater.ini"" contents, used by the Mozilla Windows Updater, and privilege escalation through the Mozilla Maintenance Service to allow for arbitrary file execution and deletion by the Maintenance Service, which has privileged access. Note: This attack requires local system access and only affects Windows. Other operating systems are not affected. This vulnerability affects Firefox ESR < 52.2 and Firefox < 54.","Mozilla","Firefox ESR","PC"
"CVE-2024-25130","Tuleap is an open source suite to improve management of software developments and collaboration. Prior to version 15.5.99.76 of Tuleap Community Edition and prior to versions 15.5-4 and 15.4-7 of Tuleap Enterprise Edition, users with a read access to a tracker where the mass update feature is used might get access to restricted information. Tuleap Community Edition 15.5.99.76, Tuleap Enterprise Edition 15.5-4, and Tuleap Enterprise Edition 15.4-7 contain a patch for this issue.","Enalean","tuleap","Other"
"CVE-2019-5156","An exploitable command injection vulnerability exists in the cloud connectivity functionality of WAGO PFC200 versions 03.02.02(14), 03.01.07(13), and 03.00.39(12). An attacker can inject operating system commands into the TimeoutPrepared parameter value contained in the firmware update command.","Wago","WAGO PFC200 Firmware","SCADA"
"CVE-2024-48788","An issue in YESCAM (com.yescom.YesCam.zwave) 1.0.2 allows a remote attacker to obtain sensitive information via the firmware update process.","n/a","n/a","Other"
"CVE-2024-23811","A vulnerability has been identified in SINEC NMS (All versions < V2.0 SP1). The affected application allows users to upload arbitrary files via TFTP. This could allow an attacker to upload malicious firmware images or other files, that could potentially lead to remote code execution.","Siemens","SINEC NMS","SCADA"
"CVE-2023-31190","DroneScout ds230 Remote ID receiver from BlueMark Innovations is affected by an Improper Authentication vulnerability during the firmware update procedure. Specifically, the firmware update procedure ignores and does not check the validity of the TLS certificate of the HTTPS endpoint from which the firmware update package (.tar.bz2 file) is downloaded. An attacker with the ability to put himself in a Man-in-the-Middle situation (e.g., DNS poisoning, ARP poisoning, control of a node on the route to the endpoint, etc.) can trick the DroneScout ds230 to install a crafted malicious firmware update containing arbitrary files (e.g., executable and configuration) and gain administrative (root) privileges on the underlying Linux operating system. This issue affects DroneScout ds230 firmware from version 20211210-1627 through 20230329-1042.","bluemark","ds230","PC"
"CVE-2024-5814","A malicious TLS1.2 server can force a TLS1.3 client with downgrade capability to use a ciphersuite that it did not agree to and achieve a successful connection. This is because, aside from the extensions, the client was skipping fully parsing the server hello. https://doi.org/10.46586/tches.v2024.i1.457-500","wolfSSL","wolfSSL","Other"
"CVE-2017-13672","QEMU (aka Quick Emulator), when built with the VGA display emulator support, allows local guest OS privileged users to cause a denial of service (out-of-bounds read and QEMU process crash) via vectors involving display update.","n/a","n/a","Other"
"CVE-2022-46914","An issue in the firmware update process of TP-LINK TL-WA801N / TL-WA801ND V1 v3.12.16 and earlier allows attackers to execute arbitrary code or cause a Denial of Service (DoS) via uploading a crafted firmware image.","n/a","n/a","Home"
"CVE-2022-23970","ASUS RT-AX56U’s update_json function has a path traversal vulnerability due to insufficient filtering for special characters in the URL parameter. An unauthenticated LAN attacker can overwrite a system file by uploading another file with the same file name, which results in service disruption.","ASUS","RT-AX56U","Home"
"CVE-2022-29957","The Emerson DeltaV Distributed Control System (DCS) through 2022-04-29 mishandles authentication. It utilizes several proprietary protocols for a wide variety of functionality. These protocols include Firmware upgrade (18508/TCP, 18518/TCP); Plug-and-Play (18510/UDP); Hawk services (18507/UDP); Management (18519/TCP); Cold restart (18512/UDP); SIS communications (12345/TCP); and Wireless Gateway Protocol (18515/UDP). None of these protocols have any authentication features, allowing any attacker capable of communicating with the ports in question to invoke (a subset of) desired functionality.","n/a","n/a","SCADA"
"CVE-2022-28372","On Verizon 5G Home LVSKIHP InDoorUnit (IDU) 3.4.66.162 and OutDoorUnit (ODU) 3.33.101.0 devices, the CRTC and ODU RPC endpoints provide a means of provisioning a firmware update for the device via crtc_fw_upgrade or crtcfwimage. The URL provided is not validated, and thus allows for arbitrary file upload to the device. This occurs in /lib/lua/luci/crtc.lua (IDU) and /lib/functions/wnc_jsonsh/wnc_crtc_fw.sh (ODU).","n/a","n/a","Mobile"
"CVE-2024-13870","An improper access control vulnerability exists in Bitdefender Box 1 (firmware version 1.3.52.928 and below) that allows an unauthenticated attacker to downgrade the device's firmware to an older, potentially vulnerable version of a Bitdefender-signed firmware. The attack requires Bitdefender BOX to be booted in Recovery Mode and that the attacker be present within the WiFi range of the BOX unit.","Bitdefender","BOX v1","Other"
"CVE-2022-34458"," Dell Command | Update, Dell Update, and Alienware Update versions prior to 4.7 contain a Exposure of Sensitive System Information to an Unauthorized Control Sphere vulnerability in download operation component. A local malicious user could potentially exploit this vulnerability leading to the disclosure of confidential data. ","Dell","Dell Command Update (DCU)","Enterprise"
"CVE-2025-32409","Ratta SuperNote A6 X2 Nomad before December 2024 allows remote code execution because an arbitrary firmware image (signed with debug keys) can be sent to TCP port 60002, and placed into the correct image-update location as a consequence of both directory traversal and unintended handling of concurrency.","Ratta","SuperNote A6 X2 Nomad","Other"
"CVE-2020-17074","Windows Update Orchestrator Service Elevation of Privilege Vulnerability","Microsoft","Windows 10 Version 1909","PC"
"CVE-2025-44018","A firmware downgrade vulnerability exists in the OTA Update functionality of GL-Inet GL-AXT1800 4.7.0. A specially crafted .tar file can lead to a firmware downgrade. An attacker can perform a man-in-the-middle attack to trigger this vulnerability.","GL-Inet","GL-AXT1800","Other"
"CVE-2020-17070","Windows Update Medic Service Elevation of Privilege Vulnerability","Microsoft","Windows 10 Version 20H2","PC"
"CVE-2024-48547","Incorrect access control in the firmware update and download processes of DreamCatcher Life v1.8.7 allows attackers to access sensitive information by analyzing the code and data within the APK file.","n/a","n/a","Other"
"CVE-2024-48539","Neye3C v4.5.2.0 was discovered to contain a hardcoded encryption key in the firmware update mechanism.","n/a","n/a","Other"
"CVE-2019-5155","An exploitable command injection vulnerability exists in the cloud connectivity feature of WAGO PFC200. An attacker can inject operating system commands into any of the parameter values contained in the firmware update command. This affects WAGO PFC200 Firmware version 03.02.02(14), version 03.01.07(13), and version 03.00.39(12)","Wago","WAGO PFC200 Firmware","SCADA"
"CVE-2018-13140","Druide Antidote through 9.5.1 on Windows and Linux allows remote code execution through the update mechanism by leveraging use of HTTP to download installation packages.","n/a","n/a","PC"
"CVE-2017-16786","The Web Configuration Utility in Meinberg LANTIME devices with firmware before 6.24.004 allows remote authenticated users with certain privileges to read arbitrary files via (1) the ntpclientcounterlogfile parameter to cgi-bin/mainv2 or (2) vectors involving curl support of the ""file"" schema in the firmware update functionality.","n/a","n/a","PC"
"CVE-2019-5231","P30 smartphones with versions earlier than ELLE-AL00B 9.1.0.186(C00E180R2P1) have an improper authorization vulnerability. The software incorrectly performs an authorization check when a user attempts to perform certain action. Successful exploit could allow the attacker to update a crafted package.","n/a","P30","Mobile"
"CVE-2024-40814","A downgrade issue was addressed with additional code-signing restrictions. This issue is fixed in macOS Sonoma 14.6. An app may be able to bypass Privacy preferences.","Apple","macOS","PC"
"CVE-2024-48777","LEDVANCE com.ledvance.smartplus.eu 2.1.10 allows a remote attacker to obtain sensitive information via the firmware update process.","n/a","n/a","Other"
"CVE-2025-15245","A vulnerability was found in D-Link DCS-850L 1.02.09. Affected is the function uploadfirmware of the component Firmware Update Service. The manipulation of the argument DownloadFile results in path traversal. The attack must originate from the local network. The exploit has been made public and could be used. This vulnerability only affects products that are no longer supported by the maintainer.","D-Link","DCS-850L","Home"
"CVE-2025-54549","Cryptographic validation of upgrade images could be circumventing by dropping a specifically crafted file into the upgrade ISO","Arista Networks","DANZ Monitoring Fabric","Enterprise"
"CVE-2024-52331","ECOVACS robot lawnmowers and vacuums use a deterministic symmetric key to decrypt firmware updates. An attacker can create and encrypt malicious firmware that will be successfully decrypted and installed by the robot.","ECOVACS","Unspecified robots","Other"
"CVE-2020-9045","During installation or upgrade to Software House C•CURE 9000 v2.70 and American Dynamics victor Video Management System v5.2, the credentials of the user used to perform the installation or upgrade are logged in a file. The install log file persists after the installation.","Johnson Controls","Software House C•CURE 9000 v2.70","Other"
"CVE-2022-48072","Phicomm K2G v22.6.3.20 was discovered to contain a command injection vulnerability via the autoUpTime parameter in the automatic upgrade function.","n/a","n/a","Other"
"CVE-2022-24543","Windows Upgrade Assistant Remote Code Execution Vulnerability","Microsoft","Windows Upgrade Assistant","PC"
"CVE-2025-11666","A flaw has been found in Tenda RP3 Pro up to 22.5.7.93. This impacts an unknown function of the file force_upgrade.sh of the component Firmware Update Handler. Executing manipulation of the argument current_force_upgrade_pwd can lead to use of hard-coded password. The attack can only be executed locally. The exploit has been published and may be used.","Tenda","RP3 Pro","Other"
"CVE-2023-34435","A firmware update vulnerability exists in the boa formUpload functionality of Realtek rtl819x Jungle SDK v3.4.11. A specially crafted network packets can lead to arbitrary firmware update. An attacker can provide a malicious file to trigger this vulnerability.","LevelOne","WBR-6013","Other"
"CVE-2024-48541","Incorrect access control in the firmware update and download processes of Ruochan Smart v4.4.7 allows attackers to access sensitive information by analyzing the code and data within the APK file.","n/a","n/a","Other"
"CVE-2019-12782","An authorization bypass vulnerability in pinboard updates in ThoughtSpot 4.4.1 through 5.1.1 (before 5.1.2) allows a low-privilege user with write access to at least one pinboard to corrupt pinboards of another user in the application by spoofing GUIDs in pinboard update requests, effectively deleting them.","n/a","n/a","Other"
"CVE-2022-20929","A vulnerability in the upgrade signature verification of Cisco Enterprise NFV Infrastructure Software (NFVIS) could allow an unauthenticated, local attacker to provide an unauthentic upgrade file for upload. This vulnerability is due to insufficient cryptographic signature verification of upgrade files. An attacker could exploit this vulnerability by providing an administrator with an unauthentic upgrade file. A successful exploit could allow the attacker to fully compromise the Cisco NFVIS system.","Cisco","Cisco Enterprise NFV Infrastructure Software","Enterprise"
"CVE-2019-11769","An issue was discovered in TeamViewer 14.2.2558. Updating the product as a non-administrative user requires entering administrative credentials into the GUI. Subsequently, these credentials are processed in Teamviewer.exe, which allows any application running in the same non-administrative user context to intercept them in cleartext within process memory. By using this technique, a local attacker is able to obtain administrative credentials in order to elevate privileges. This vulnerability can be exploited by injecting code into Teamviewer.exe which intercepts calls to GetWindowTextW and logs the processed credentials.","n/a","n/a","Other"
"CVE-2019-7323","GUP (generic update process) in LightySoft LogMX before 7.4.0 does not properly verify the authenticity of updates, which allows man-in-the-middle attackers to execute arbitrary code via a Trojan horse update. The update process relies on cleartext HTTP. The attacker could replace the LogMXUpdater.class file.","n/a","n/a","Other"
"CVE-2022-34436"," Dell iDRAC8 version 2.83.83.83 and prior contain an improper input validation vulnerability in Racadm when the firmware lock-down configuration is set. A remote high privileged attacker could exploit this vulnerability to bypass the firmware lock-down configuration and perform a firmware update. ","Dell","Integrated Dell Remote Access Controller 8","Enterprise"
"CVE-2021-36888","Unauthenticated Arbitrary Options Update vulnerability leading to full website compromise discovered in Image Hover Effects Ultimate (versions <= 9.6.1) WordPress plugin.","Oxilab","Image Hover Effects Ultimate (WordPress plugin)","Home"
"CVE-2018-5402","The Auto-Maskin DCU 210E, RP-210E, and Marine Pro Observer Android App use an embedded webserver that uses unencrypted plaintext for the transmission of the administrator PIN Impact: An attacker once authenticated can change configurations, upload new configuration files, and upload executable code via file upload for firmware updates. Requires access to the network. Affected releases are Auto-Maskin DCU-210E, RP-210E, and the Marine Pro Observer Android App. Versions prior to 3.7 on ARMv7.","Auto-Maskin","DCU-210E","PC"
"CVE-2021-36277","Dell Command | Update, Dell Update, and Alienware Update versions before 4.3 contains an Improper Verification of Cryptographic Signature Vulnerability. A local authenticated malicious user may exploit this vulnerability by executing arbitrary code on the system.","Dell","Alienware Command Center (AWCC)","Enterprise"
"CVE-2023-6158","The EventON - WordPress Virtual Event Calendar Plugin plugin for WordPress is vulnerable to unauthorized modification of data and loss of data due to a missing capability check on the evo_eventpost_update_meta function in all versions up to, and including, 4.5.4 (for Pro) and 2.2.7 (for free). This makes it possible for unauthenticated attackers to update and remove arbitrary post metadata. Note that certain parameters may allow for content injection.","ashanjay","EventON","Other"
"CVE-2023-32156","Tesla Model 3 Gateway Firmware Signature Validation Bypass Vulnerability. This vulnerability allows network-adjacent attackers to execute arbitrary code on affected Tesla Model 3 vehicles. An attacker must first obtain the ability to execute privileged code on the Tesla infotainment system in order to exploit this vulnerability. The specific flaw exists within the handling of firmware updates. The issue results from improper error-handling during the update process. An attacker can leverage this vulnerability to execute code in the context of Tesla's Gateway ECU. . Was ZDI-CAN-20734.","Tesla","Model 3","Other"
"CVE-2025-52873","Cognex In-Sight Explorer and In-Sight Camera Firmware expose a telnet-based service on port 23 to allow management operations such as firmware upgrades and device reboots, which require authentication. A user with protected privileges can successfully invoke the SetSystemConfig functionality to modify relevant device properties (such as network settings), contradicting the security model proposed in the user manual.","Cognex","In-Sight 2000 series","Other"
"CVE-2022-35946","GLPI stands for Gestionnaire Libre de Parc Informatique and is a Free Asset and IT Management Software package, that provides ITIL Service Desk features, licenses tracking and software auditing. In affected versions request input is not properly validated in the plugin controller and can be used to access low-level API of Plugin class. An attacker can, for instance, alter database data. Attacker must have ""General setup"" update rights to be able to perform this attack. Users are advised to upgrade to version 10.0.3. Users unable to upgrade should remove the `front/plugin.form.php` script.","glpi-project","glpi","Enterprise"
"CVE-2021-41870","An issue was discovered in the firmware update form in Socomec REMOTE VIEW PRO 2.0.41.4. An authenticated attacker can bypass a client-side file-type check and upload arbitrary .php files.","n/a","n/a","Other"
"CVE-2018-16089","In System Management Module (SMM) versions prior to 1.06, a field in the header of SMM firmware update images is insufficiently sanitized, allowing post-authentication command injection on the SMM as the root user.","Lenovo","ThinkSystem SMM","Mobile"
"CVE-2021-20221","An out-of-bounds heap buffer access issue was found in the ARM Generic Interrupt Controller emulator of QEMU up to and including qemu 4.2.0on aarch64 platform. The issue occurs because while writing an interrupt ID to the controller memory area, it is not masked to be 4 bits wide. It may lead to the said issue while updating controller state fields and their subsequent processing. A privileged guest user may use this flaw to crash the QEMU process on the host resulting in DoS scenario.","n/a","qemu","Other"
"CVE-2021-0263","A Data Processing vulnerability in the Multi-Service process (multi-svcs) on the FPC of Juniper Networks Junos OS on the PTX Series routers may lead to the process becoming unresponsive, ultimately affecting traffic forwarding, allowing an attacker to cause a Denial of Service (DoS) condition . The Multi-Service Process running on the FPC is responsible for handling sampling-related operations when a J-Flow configuration is activated. This can occur during periods of heavy route churn, causing the Multi-Service Process to stop processing updates, without consuming any further updates from kernel. This back pressure towards the kernel affects further dynamic updates from other processes in the system, including RPD, causing a KRT-STUCK condition and traffic forwarding issues. An administrator can monitor the following command to check if there is the KRT queue is stuck: user@device > show krt state ... Number of async queue entries: 65007 <--- this value keep on increasing. The following logs/alarms will be observed when this condition exists: user@junos> show chassis alarms 2 alarms currently active Alarm time Class Description 2020-10-11 04:33:45 PDT Minor Potential slow peers are: MSP(FPC1-PIC0) MSP(FPC3-PIC0) MSP(FPC4-PIC0) Logs: Oct 11 04:33:44.672 2020 test /kernel: rts_peer_cp_recv_timeout : Bit set for msp8 as it is stuck Oct 11 04:35:56.000 2020 test-lab fpc4 user.err gldfpc-multi-svcs.elf: Error in parsing composite nexthop Oct 11 04:35:56.000 2020 test-lab fpc4 user.err gldfpc-multi-svcs.elf: composite nexthop parsing error Oct 11 04:43:05 2020 test /kernel: rt_pfe_veto: Possible slowest client is msp38. States processed - 65865741. States to be processed - 0 Oct 11 04:55:55 2020 test /kernel: rt_pfe_veto: Memory usage of M_RTNEXTHOP type = (0) Max size possible for M_RTNEXTHOP type = (8311787520) Current delayed unref = (60000), Current unique delayed unref = (10896), Max delayed unref on this platform = (40000) Current delayed weight unref = (71426) Max delayed weight unref on this platform= (400000) curproc = rpd Oct 11 04:56:00 2020 test /kernel: rt_pfe_veto: Too many delayed route/nexthop unrefs. Op 2 err 55, rtsm_id 5:-1, msg type 2 This issue only affects PTX Series devices. No other products or platforms are affected by this vulnerability. This issue affects Juniper Networks Junos OS on PTX Series: 18.2 versions prior to 18.2R3-S7; 18.3 versions prior to 18.3R3-S4; 18.4 versions prior to 18.4R2-S8, 18.4R3-S7; 19.1 versions prior to 19.1R3-S4; 19.2 versions prior to 19.2R3-S1; 19.3 versions prior to 19.3R3-S1; 19.4 versions prior to 19.4R2-S4, 19.4R3-S1; 20.1 versions prior to 20.1R2; 20.2 versions prior to 20.2R2; 20.3 versions prior to 20.3R1-S2, 20.3R2. This issue does not affect Juniper Networks Junos OS versions prior to 18.2R1.","Juniper Networks","Junos OS","Enterprise"
"CVE-2021-33879","Tencent GameLoop before 4.1.21.90 downloaded updates over an insecure HTTP connection. A malicious attacker in an MITM position could spoof the contents of an XML document describing an update package, replacing a download URL with one pointing to an arbitrary Windows executable. Because the only integrity check would be a comparison of the downloaded file's MD5 checksum to the one contained within the XML document, the downloaded executable would then be executed on the victim's machine.","n/a","n/a","PC"
"CVE-2019-6844","A CWE-755: Improper Handling of Exceptional Conditions vulnerability exists in Modicon M580, Modicon M340, Modicon BMxCRA and 140CRA modules (all firmware versions), which could cause a Denial of Service atack on the PLC when upgrading the controller with a firmware package containing an invalid web server image using FTP protocol.","n/a","Modicon M580, Modicon M340, and Modicon BMxCRA / 140CRA modules (see notification for version info)","SCADA"
"CVE-2020-17077","Windows Update Stack Elevation of Privilege Vulnerability","Microsoft","Windows 10 Version 20H2","PC"
"CVE-2020-24395","The USB firmware update script of homee Brain Cube v2 (2.28.2 and 2.28.4) devices allows an attacker with physical access to install compromised firmware. This occurs because of insufficient validation of the firmware image file and can lead to code execution on the device.","n/a","n/a","Other"
"CVE-2020-9751","Naver Cloud Explorer before 2.2.2.11 allows the system to download an arbitrary file from the attacker's server and execute it during the upgrade.","NAVER Corporation","Naver Cloud Explorer","Other"
"CVE-2023-41368","The OData service of the S4 HANA (Manage checkbook apps) - versions 102, 103, 104, 105, 106, 107, allows an attacker to change the checkbook name by simulating an update OData call. ","SAP_SE","S4 HANA ABAP (Manage checkbook apps)","Enterprise"
"CVE-2016-10305","Trango Apex <= 2.1.1, ApexLynx < 2.0, ApexOrion < 2.0, ApexPlus <= 3.2.0, Giga <= 2.6.1, GigaLynx < 2.0, GigaOrion < 2.0, GigaPlus <= 3.2.3, GigaPro <= 1.4.1, StrataLink < 3.0, and StrataPro devices have a built-in, hidden root account, with a default password that was once stored in cleartext within a software update package on a Trango FTP server. This account is accessible via SSH and/or TELNET, and grants access to the underlying embedded UNIX OS on the device, allowing full control over it.","n/a","n/a","Home"
"CVE-2020-8342","A race condition vulnerability was reported in Lenovo System Update prior to version 5.07.0106 that could allow escalation of privilege.","Lenovo","System Update","Mobile"
"CVE-2025-53022","TrustedFirmware-M (aka Trusted Firmware for M profile Arm CPUs) before 2.1.3 and 2.2.x before 2.2.1 lacks length validation during a firmware upgrade. While processing a new image, the Firmware Upgrade (FWU) module does not validate the length field of the Type-Length-Value (TLV) structure for dependent components against the maximum allowed size. If the length specified in the TLV exceeds the size of the buffer allocated on the stack, the FWU module will overwrite the buffer (and potentially other stack data) with the TLV's value content. An attacker could exploit this by crafting a malicious TLV entry in the unprotected section of the MCUBoot upgrade image. By setting the length field to exceed the expected structure size, the attacker can manipulate the stack memory of the system during the upgrade process.","n/a","n/a","Other"
"CVE-2022-24525","Windows Update Stack Elevation of Privilege Vulnerability","Microsoft","Windows 10 Version 1909","PC"
"CVE-2024-48784","An Incorrect Access Control issue in SAMPMAX com.sampmax.homemax 2.1.2.7 allows a remote attacker to obtain sensitive information via the firmware update process.","n/a","n/a","Other"
