"id","description","vendor","product","IoT_class"
"CVE-2024-38414","Information disclosure while processing information on firmware image during core initialization.","Qualcomm, Inc.","Snapdragon","Enterprise"
"CVE-2025-43331","A downgrade issue was addressed with additional code-signing restrictions. This issue is fixed in macOS Tahoe 26. An app may be able to access protected user data.","Apple","macOS","PC"
"CVE-2024-47865","Missing authentication for critical function vulnerability exists in Rakuten Turbo 5G firmware version V1.3.18 and earlier. If this vulnerability is exploited, a remote unauthenticated attacker may update or downgrade the firmware on the device.","Rakuten Mobile, Inc.","Rakuten Turbo 5G","Mobile"
"CVE-2021-30668","This issue was addressed with improved checks. This issue is fixed in macOS Big Sur 11.4. A person with physical access to a Mac may be able to bypass Login Window during a software update.","Apple","macOS","PC"
"CVE-2016-5295","This vulnerability allows an attacker to use the Mozilla Maintenance Service to escalate privilege by having the Maintenance Service invoke the Mozilla Updater to run malicious local files. This vulnerability requires local system access and is a variant of MFSA2013-44. Note: this issue only affects Windows operating systems. This vulnerability affects Firefox < 50.","Mozilla","Firefox","PC"
"CVE-2023-25163","Argo CD is a declarative, GitOps continuous delivery tool for Kubernetes. All versions of Argo CD starting with v2.6.0-rc1 have an output sanitization bug which leaks repository access credentials in error messages. These error messages are visible to the user, and they are logged. The error message is visible when a user attempts to create or update an Application via the Argo CD API (and therefor the UI or CLI). The user must have `applications, create` or `applications, update` RBAC access to reach the code which may produce the error. The user is not guaranteed to be able to trigger the error message. They may attempt to spam the API with requests to trigger a rate limit error from the upstream repository. If the user has `repositories, update` access, they may edit an existing repository to introduce a URL typo or otherwise force an error message. But if they have that level of access, they are probably intended to have access to the credentials anyway. A patch for this vulnerability has been released in version 2.6.1. Users are advised to upgrade. There are no known workarounds for this vulnerability.","argoproj","argo-cd","Other"
"CVE-2020-7135","A potential security vulnerability has been identified in the disk drive firmware installers named Supplemental Update / Online ROM Flash Component on HPE servers running Linux. The vulnerable software is included in the HPE Service Pack for ProLiant (SPP) releases 2018.06.0, 2018.09.0, and 2018.11.0. The vulnerable software is the Supplemental Update / Online ROM Flash Component for Linux (x64) software. The installer in this software component could be locally exploited to execute arbitrary code. Drive Models can be found in the Vulnerability Resolution field of the security bulletin. The 2019_03 SPP and Supplemental update / Online ROM Flash Component for Linux (x64) after 2019.03.0 has fixed this issue.","HPE","HPE Service Pack for ProLiant","PC"
"CVE-2021-33907","The Zoom Client for Meetings for Windows in all versions before 5.3.0 fails to properly validate the certificate information used to sign .msi files when performing an update of the client. This could lead to remote code execution in an elevated privileged context.","n/a","Zoom Client for Meetings for Windows","PC"
"CVE-2022-20789","A vulnerability in the software upgrade process of Cisco Unified Communications Manager (Unified CM) and Cisco Unified Communications Manager Session Management Edition (Unified CM SME) could allow an authenticated, remote attacker to write arbitrary files on the affected system. This vulnerability is due to improper restrictions applied to a system script. An attacker could exploit this vulnerability by using crafted variables during the execution of a system upgrade. A successful exploit could allow the attacker to overwrite or append arbitrary data to system files using root-level privileges.","Cisco","Cisco Unified Communications Manager","Enterprise"
"CVE-2019-6564","GE Communicator, all versions prior to 4.0.517, allows a non-administrative user to place malicious files within the installer file directory, which may allow an attacker to gain administrative privileges on a system during installation or upgrade.","n/a","GE Communicator","Other"
"CVE-2022-23764","The vulnerability causing from insufficient verification procedures for downloaded files during WebCube update. Remote attackers can bypass this verification logic to update both digitally signed and unauthorized files, enabling remote code execution.","TERUTEN Co.,Ltd","WebCube","Other"
"CVE-2020-6174","TUF (aka The Update Framework) through 0.12.1 has Improper Verification of a Cryptographic Signature.","n/a","n/a","Other"
"CVE-2021-40419","A firmware update vulnerability exists in the 'factory' binary of reolink RLC-410W v3.0.0.136_20121102. A specially-crafted series of network requests can lead to arbitrary firmware update. An attacker can send a sequence of requests to trigger this vulnerability.","n/a","n/a","SCADA"
"CVE-2019-17449","Avira Software Updater before 2.0.6.21094 allows a DLL side-loading attack. NOTE: The vendor thinks that this vulnerability is invalid because exploiting it would require at least administrator privileges and would gain only SYSTEM privileges","n/a","n/a","Other"
"CVE-2021-22675","The affected product is vulnerable to integer overflow while parsing malformed over-the-air firmware update files, which may allow an attacker to remotely execute code on SimpleLink Wi-Fi (MSP432E4 SDK: v4.20.00.12 and prior, CC32XX SDK v4.30.00.06 and prior, CC13X0 SDK versions prior to v4.10.03, CC13X2 and CC26XX SDK versions prior to v4.40.00, CC3200 SDK v1.5.0 and prior, CC3100 SDK v1.3.0 and prior).","n/a","SimpleLink Wi-Fi, MSP432, CC13XX, CC26XX, CC32XX, CC3100","Other"
"CVE-2016-1365","The Grapevine update process in Cisco Application Policy Infrastructure Controller Enterprise Module (APIC-EM) 1.0 allows remote authenticated users to execute arbitrary commands as root via a crafted upgrade parameter, aka Bug ID CSCux15507.","n/a","n/a","Enterprise"
"CVE-2023-27389","Inadequate encryption strength vulnerability in CONPROSYS IoT Gateway products allows a remote authenticated attacker with an administrative privilege to apply a specially crafted Firmware update file, alter the information, cause a denial-of-service (DoS) condition, and/or execute arbitrary code. The affected products and versions are as follows: M2M Gateway with the firmware Ver.3.7.10 and earlier (CPS-MG341-ADSC1-111, CPS-MG341-ADSC1-931, CPS-MG341G-ADSC1-111, CPS-MG341G-ADSC1-930, and CPS-MG341G5-ADSC1-931), M2M Controller Integrated Type with firmware Ver.3.7.6 and earlier versions (CPS-MC341-ADSC1-111, CPS-MC341-ADSC1-931, CPS-MC341-ADSC2-111, CPS-MC341G-ADSC1-110, CPS-MC341Q-ADSC1-111, CPS-MC341-DS1-111, CPS-MC341-DS11-111, CPS-MC341-DS2-911, and CPS-MC341-A1-111), and M2M Controller Configurable Type with firmware Ver.3.8.8 and earlier versions (CPS-MCS341-DS1-111, CPS-MCS341-DS1-131, CPS-MCS341G-DS1-130, CPS-MCS341G5-DS1-130, and CPS-MCS341Q-DS1-131).","Contec CO.,LTD.","CONPROSYS IoT Gateway products","Enterprise"
"CVE-2019-6841","A CWE-755: Improper Handling of Exceptional Conditions vulnerability exists in Modicon M580 with firmware (version prior to V3.10), Modicon M340 (all firmware versions), and Modicon BMxCRA and 140CRA modules (all firmware versions), which could cause a Denial of Service attack on the PLC when upgrading the firmware with no firmware image inside the package using FTP protocol.","n/a","Modicon M580, Modicon M340, and Modicon BMxCRA / 140CRA modules (see notification for version info)","SCADA"
"CVE-2024-48790","An issue in ILIFE com.ilife.home.global 1.8.7 allows a remote attacker to obtain sensitive information via the firmware update process.","n/a","n/a","Other"
"CVE-2024-4762","An improper validation vulnerability was reported in the firmware update mechanism of LADM and LDCC that could allow a local attacker to escalate privileges.","Lenovo","Accessories and Display Manager","PC"
"CVE-2019-5160","An exploitable improper host validation vulnerability exists in the Cloud Connectivity functionality of WAGO PFC200 Firmware versions 03.02.02(14), 03.01.07(13), and 03.00.39(12). A specially crafted HTTPS POST request can cause the software to connect to an unauthorized host, resulting in unauthorized access to firmware update functionality. An attacker can send an authenticated HTTPS POST request to direct the Cloud Connectivity software to connect to an attacker controlled Azure IoT Hub node.","Wago","WAGO PFC200 Firmware","SCADA"
"CVE-2021-3960","Improper Limitation of a Pathname to a Restricted Directory ('Path Traversal') vulnerability in the UpdateServer component of Bitdefender GravityZone allows an attacker to execute arbitrary code on vulnerable instances. This issue affects Bitdefender GravityZone versions prior to 3.3.8.272","Bitdefender","GravityZone","Enterprise"
"CVE-2019-19463","The Anhui Huami Mi Fit application before 4.0.11 for Android has an Unencrypted Update Check.","n/a","n/a","Mobile"
"CVE-2025-27711","Incorrect default permissions for some Intel(R) One Boot Flash Update (Intel(R) OFU) software before version 14.1.31 within Ring 3: User Applications may allow an escalation of privilege. Unprivileged software adversary with an authenticated user combined with a high complexity attack may enable escalation of privilege. This result may potentially occur via local access when attack requirements are present without special internal knowledge and requires active user interaction. The potential vulnerability may impact the confidentiality (high), integrity (high) and availability (high) of the vulnerable system, resulting in subsequent system confidentiality (none), integrity (none) and availability (none) impacts.","n/a","Intel(R) One Boot Flash Update (Intel(R) OFU) software","Home"
"CVE-2019-1649","A vulnerability in the logic that handles access control to one of the hardware components in Cisco's proprietary Secure Boot implementation could allow an authenticated, local attacker to write a modified firmware image to the component. This vulnerability affects multiple Cisco products that support hardware-based Secure Boot functionality. The vulnerability is due to an improper check on the area of code that manages on-premise updates to a Field Programmable Gate Array (FPGA) part of the Secure Boot hardware implementation. An attacker with elevated privileges and access to the underlying operating system that is running on the affected device could exploit this vulnerability by writing a modified firmware image to the FPGA. A successful exploit could either cause the device to become unusable (and require a hardware replacement) or allow tampering with the Secure Boot verification process, which under some circumstances may allow the attacker to install and boot a malicious software image. An attacker will need to fulfill all the following conditions to attempt to exploit this vulnerability: Have privileged administrative access to the device. Be able to access the underlying operating system running on the device; this can be achieved either by using a supported, documented mechanism or by exploiting another vulnerability that would provide an attacker with such access. Develop or have access to a platform-specific exploit. An attacker attempting to exploit this vulnerability across multiple affected platforms would need to research each one of those platforms and then develop a platform-specific exploit. Although the research process could be reused across different platforms, an exploit developed for a given hardware platform is unlikely to work on a different hardware platform.","Cisco","Cisco Routers","Enterprise"
"CVE-2025-24505","This vulnerability allows a high-privileged authenticated PAM user to achieve remote command execution on the affected PAM system by uploading a specially crafted upgrade file.","Broadcom","Symantec Privileged Access Management","Enterprise"
"CVE-2022-36385","A threat actor with momentary access to the device can plug in a USB drive and perform a malicious firmware update, resulting in permanent changes to device functionality. No authentication or controls are in place to prevent a threat actor from maliciously modifying firmware and performing a drive-by attack to load the firmware on any CMS8000 device.","Contec Health","CMS8000 CONTEC ICU CCU Vital Signs Patient Monitor","Home"
"CVE-2016-8237","Remote code execution in Lenovo Updates (not Lenovo System Update) allows man-in-the-middle attackers to execute arbitrary code.","Lenovo Group Ltd.","Lenovo Updates","Mobile"
"CVE-2022-28226","Local privilege vulnerability in Yandex Browser for Windows prior to 22.3.3.801 allows a local, low privileged, attacker to execute arbitary code with the SYSTEM privileges through manipulating temporary files in directory with insecure permissions during Yandex Browser update process.","n/a","Yandex Browser (Desktop)","PC"
"CVE-2020-7810","hslogin2.dll ActiveX Control in Groupware contains a vulnerability that could allow remote files to be downloaded and executed by setting the arguments to the activex method. This is due to a lack of integrity verification of the policy files referenced in the update process, and a remote attacker could induce a user to crafted web page, causing damage such as malicious code infection.","Handysoft, Inc.","hslogin2.dll","Other"
"CVE-2022-36121","An issue was discovered in Blue Prism Enterprise 6.0 through 7.01. In a misconfigured environment that exposes the Blue Prism Application server, it is possible for an authenticated user to reverse engineer the Blue Prism software and circumvent access controls for the UpdateOfflineHelpData administrative function. Abusing this function will allow any Blue Prism user to change the offline help URL to one of their choice, opening the possibility of spoofing the help page or executing a local file.","n/a","n/a","PC"
"CVE-2016-2826","The maintenance service in Mozilla Firefox before 47.0 and Firefox ESR 45.x before 45.2 on Windows does not prevent MAR extracted-file modification during updater execution, which might allow local users to gain privileges via a Trojan horse file.","n/a","n/a","PC"
"CVE-2019-6440","Zemana AntiMalware before 3.0.658 Beta mishandles update logic.","n/a","n/a","Other"
"CVE-2024-48792","An issue in Hideez com.hideez 2.7.8.3 allows a remote attacker to obtain sensitive information via the firmware update process.","n/a","n/a","Other"
"CVE-2016-5119","The automatic update feature in KeePass 2.33 and earlier allows man-in-the-middle attackers to execute arbitrary code by spoofing the version check response and supplying a crafted update.","n/a","n/a","Home"
"CVE-2023-32660","Uncontrolled search path in some Intel(R) NUC Kit NUC6i7KYK Thunderbolt(TM) 3 Firmware Update Tool installation software before version 46 may allow an authenticated user to potentially enable escalation of privilege via local access.","n/a","Intel(R) NUC Kit NUC6i7KYK Thunderbolt(TM) 3 Firmware Update Tool installation software","Other"
"CVE-2017-15884","In HashiCorp Vagrant VMware Fusion plugin (aka vagrant-vmware-fusion) 5.0.0, a local attacker or malware can silently subvert the plugin update process in order to escalate to root privileges.","n/a","n/a","Enterprise"
"CVE-2020-25755","An issue was discovered on Enphase Envoy R3.x and D4.x (and other current) devices. The upgrade_start function in /installer/upgrade_start allows remote authenticated users to execute arbitrary commands via the force parameter.","n/a","n/a","Other"
"CVE-2022-34384"," Dell SupportAssist Client Consumer (version 3.11.1 and prior), SupportAssist Client Commercial (version 3.2 and prior), Dell Command | Update, Dell Update, and Alienware Update versions before 4.5 contain a Local Privilege Escalation Vulnerability in the Advanced Driver Restore component. A local malicious user may potentially exploit this vulnerability, leading to privilege escalation. ","Dell","SupportAssist Client Consumer","PC"
"CVE-2023-40254","Download of Code Without Integrity Check vulnerability in Genians Genian NAC V4.0, Genians Genian NAC V5.0, Genians Genian NAC Suite V5.0, Genians Genian ZTNA allows Malicious Software Update.This issue affects Genian NAC V4.0: from V4.0.0 through V4.0.155; Genian NAC V5.0: from V5.0.0 through V5.0.42 (Revision 117460); Genian NAC Suite V5.0: from V5.0.0 through V5.0.54; Genian ZTNA: from V6.0.0 through V6.0.15. ","Genians","Genian NAC V4.0","SCADA"
"CVE-2021-25261","Local privilege vulnerability in Yandex Browser for Windows prior to 22.5.0.862 allows a local, low privileged, attacker to execute arbitary code with the SYSTEM privileges through manipulating symlinks to installation file during Yandex Browser update process.","n/a","Yandex Browser (Desktop)","PC"
"CVE-2023-3181","The C:\Program Files (x86)\Splashtop\Splashtop Software Updater\uninst.exe process creates a folder at C:\Windows\Temp~nsu.tmp and copies itself to it as Au_.exe. The C:\Windows\Temp~nsu.tmp\Au_.exe file is automatically launched as SYSTEM when the system reboots or when a standard user runs an MSI repair using Splashtop Streamer’s Windows Installer. Since the C:\Windows\Temp~nsu.tmp folder inherits permissions from C:\Windows\Temp and Au_.exe is susceptible to DLL hijacking, standard users can write a malicious DLL to it and elevate their privileges.","Splashtop","Splashtop Software Updater","PC"
"CVE-2022-30262","The Emerson ControlWave 'Next Generation' RTUs through 2022-05-02 mishandle firmware integrity. They utilize the BSAP-IP protocol to transmit firmware updates. Firmware updates are supplied as CAB archive files containing a binary firmware image. In all cases, firmware images were found to have no authentication (in the form of firmware signing) and only relied on insecure checksums for regular integrity checks.","n/a","n/a","Other"
"CVE-2025-67846","The Deployment Infrastructure in Mintlify Platform before 2025-11-15 allows remote attackers to bypass security patches and execute downgrade attacks via predictable deployment identifiers on the Vercel preview domain. An attacker can identify the URL structure of a previous deployment that contains unpatched vulnerabilities. By browsing directly to the specific git-ref or deployment-id subdomain, the attacker can force the application to load the vulnerable version.","Mintlify","Mintlify Platform","Other"
"CVE-2019-5226","P30, P30 Pro, Mate 20 smartphones with software of versions earlier than ELLE-AL00B 9.1.0.193(C00E190R2P1), versions earlier than VOGUE-AL00A 9.1.0.193(C00E190R2P1), versions earlier than Hima-AL00B 9.1.0.135(C00E133R2P1) and HiSuite with versions earlier than HiSuite 9.1.0.305 have a version downgrade vulnerability. The device and HiSuite software do not validate the upgrade package sufficiently, so that the system of smartphone can be downgraded to an older version.","n/a","P30, P30 Pro, Mate 20, HiSuite","Mobile"
"CVE-2023-1083","An unauthenticated remote attacker who is aware of a MQTT topic name can send and receive messages, including GET/SET configuration commands, reboot commands and firmware updates.","Welotec","TK515L","Other"
"CVE-2017-7450","AIRTAME HDMI dongle with firmware before 2.2.0 allows unauthenticated access to a big part of the management interface. It is possible to extract all information including the Wi-Fi password, reboot, or force a software update at an arbitrary time.","n/a","n/a","Other"
"CVE-2017-2872","Insufficient security checks exist in the recovery procedure used by the Foscam C1 Indoor HD Camera running application firmware 2.52.2.43. A HTTP request can allow for a user to perform a firmware upgrade using a crafted image. Before any firmware upgrades in this image are flashed to the device, binaries as well as arguments to shell commands contained in the image are executed with elevated privileges.","Foscam","Foscam Indoor IP Camera C1 Series","Home"
"CVE-2020-0985","An elevation of privilege vulnerability exists when the Windows Update Stack fails to properly handle objects in memory, aka 'Windows Update Stack Elevation of Privilege Vulnerability'. This CVE ID is unique from CVE-2020-0996.","Microsoft","Windows","PC"
"CVE-2020-15297","Insufficient validation in the Bitdefender Update Server and BEST Relay components of Bitdefender Endpoint Security Tools versions prior to 6.6.20.294 allows an unprivileged attacker to bypass the in-place mitigations and interact with hosts on the network. This issue affects: Bitdefender Update Server versions prior to 6.6.20.294.","Bitdefender","Bitdefender Update Server","Enterprise"
"CVE-2019-3977","RouterOS 6.45.6 Stable, RouterOS 6.44.5 Long-term, and below insufficiently validate where upgrade packages are download from when using the autoupgrade feature. Therefore, a remote attacker can trick the router into ""upgrading"" to an older version of RouterOS and possibly reseting all the system's usernames and passwords.","n/a","MikroTik RouterOS","Home"
"CVE-2021-22278","A certificate validation vulnerability in PCM600 Update Manager allows attacker to get unwanted software packages to be installed on computer which has PCM600 installed.","ABB","PCM600","PC"
"CVE-2019-16000","A vulnerability in the automatic update process of Cisco Umbrella Roaming Client for Windows could allow an authenticated, local attacker to install arbitrary, unapproved applications on a targeted device. The vulnerability is due to insufficient verification of the Windows Installer. An attacker could exploit this vulnerability by placing a file in a specific location in the Windows file system. A successful exploit could allow the attacker to bypass configured policy and install unapproved applications.","Cisco","Cisco Umbrella Enterprise Roaming Client for Windows","Enterprise"
"CVE-2025-47698","An adjacent attacker without authentication can exploit this vulnerability to retrieve a set of user-privileged credentials. These credentials are present during the firmware upgrade procedure.","Cognex","In-Sight 2000 series","Other"
"CVE-2019-6834","A CWE-502: Deserialization of Untrusted Data vulnerability exists which could allow an attacker to execute arbitrary code on the targeted system with SYSTEM privileges when placing a malicious user to be authenticated for this vulnerability to be successfully exploited. Affected Product: Schneider Electric Software Update (SESU) SUT Service component (V2.1.1 to V2.3.0)","Schneider Electric","Software Update (SESU) – SUT Service component","SCADA"
"CVE-2024-52938","Kernel software installed and running inside a Guest VM may post improper commands to the GPU Firmware to subvert reconstruction activities to trigger a write of data outside the Guest's virtualised GPU memory.","Imagination Technologies","Graphics DDK","SCADA"
"CVE-2025-8978","A vulnerability was determined in D-Link DIR-619L 6.02CN02. Affected is the function FirmwareUpgrade of the component boa. The manipulation leads to insufficient verification of data authenticity. It is possible to launch the attack remotely. The complexity of an attack is rather high. The exploitability is told to be difficult. The exploit has been disclosed to the public and may be used. This vulnerability only affects products that are no longer supported by the maintainer.","D-Link","DIR-619L","Home"
"CVE-2018-3969","An exploitable vulnerability exists in the verified boot protection of the CUJO Smart Firewall. It is possible to add arbitrary shell commands into the dhcpd.conf file, that persist across reboots and firmware updates, and thus allow for executing unverified commands. To trigger this vulnerability, a local attacker needs to be able to write into /config/dhcpd.conf.","n/a","CUJO","Enterprise"
"CVE-2020-6965","In ApexPro Telemetry Server Versions 4.2 and prior, CARESCAPE Telemetry Server v4.2 & prior, Clinical Information Center (CIC) Versions 4.X and 5.X, CARESCAPE Central Station (CSCS) Versions 1.X, B450 Version 2.X, B650 Version 1.X, B650 Version 2.X, B850 Version 1.X, B850 Version 2.X, a vulnerability in the software update mechanism allows an authenticated attacker to upload arbitrary files on the system through a crafted update package.","n/a","GE CARESCAPE Telemetry Server,ApexPro Telemetry Server,CARESCAPE Central Station,Clinical Information Center systems,CARESCAPE B450,B650,B850 Monitors","SCADA"
"CVE-2016-10370","An issue was discovered on OnePlus devices such as the 3T. The OnePlus OTA Updater pushes the signed-OTA image over HTTP without TLS. While it does not allow for installation of arbitrary OTAs (due to the digital signature), it unnecessarily increases the attack surface, and allows for remote exploitation of other vulnerabilities such as CVE-2017-5948, CVE-2017-8850, and CVE-2017-8851.","n/a","n/a","Other"
"CVE-2020-6650","UPS companion software v1.05 & Prior is affected by ‘Eval Injection’ vulnerability. The software does not neutralize or incorrectly neutralizes code syntax before using the input in a dynamic evaluation call e.g.”eval” in “Update Manager” class when software attempts to see if there are updates available. This results in arbitrary code execution on the machine where software is installed.","Eaton","UPS Companion Software","PC"
"CVE-2023-28610","The update process in OMICRON StationGuard and OMICRON StationScout before 2.21 can be exploited by providing a modified firmware update image. This allows a remote attacker to gain root access to the system.","n/a","n/a","Other"
