"id","description","vendor","product","IoT_class"
"CVE-2023-32056","Windows Server Update Service (WSUS) Elevation of Privilege Vulnerability","Microsoft","Windows 10 Version 1809","PC"
"CVE-2025-28236","Nautel VX Series transmitters VX SW v6.4.0 and below was discovered to contain a remote code execution (RCE) vulnerability in the firmware update process. This vulnerability allows attackers to execute arbitrary code via supplying a crafted update package to the /#/software/upgrades endpoint.","n/a","n/a","Home"
"CVE-2023-28337","When uploading a firmware image to a Netgear Nighthawk Wifi6 Router (RAX30), a hidden “forceFWUpdate” parameter may be provided to force the upgrade to complete and bypass certain validation checks. End users can use this to upload modified, unofficial, and potentially malicious firmware to the device.","n/a","NETGEAR Nighthawk WiFi6 Router (RAX30)","Home"
"CVE-2017-9860","An issue was discovered in SMA Solar Technology products. An attacker can use Sunny Explorer or the SMAdata2+ network protocol to update the device firmware without ever having to authenticate. If an attacker is able to create a custom firmware version that is accepted by the inverter, the inverter is compromised completely. This allows the attacker to do nearly anything: for example, giving access to the local OS, creating a botnet, using the inverters as a stepping stone into companies, etc. NOTE: the vendor reports that this attack has always been blocked by ""a final integrity and compatibility check."" Also, only Sunny Boy TLST-21 and TL-21 and Sunny Tripower TL-10 and TL-30 could potentially be affected","n/a","n/a","Other"
"CVE-2023-20082","A vulnerability in Cisco IOS XE Software for Cisco Catalyst 9300 Series Switches could allow an authenticated, local attacker with level-15 privileges or an unauthenticated attacker with physical access to the device to execute persistent code at boot time and break the chain of trust. This vulnerability is due to errors that occur when retrieving the public release key that is used for image signature verification. An attacker could exploit this vulnerability by modifying specific variables in the Serial Peripheral Interface (SPI) flash memory of an affected device. A successful exploit could allow the attacker to execute persistent code on the underlying operating system. Note: In Cisco IOS XE Software releases 16.11.1 and later, the complexity of an attack using this vulnerability is high. However, an attacker with level-15 privileges could easily downgrade the Cisco IOS XE Software on a device to a release that would lower the attack complexity.","Cisco","Cisco IOS XE ROMMON Software ","Enterprise"
"CVE-2021-43984","mySCADA myPRO: Versions 8.20.0 and prior has a feature where the firmware can be updated, which may allow an attacker to inject arbitrary operating system commands through a specific parameter.","mySCADA","myPRO","PC"
"CVE-2018-3920","An exploitable code execution vulnerability exists in the firmware update functionality of the Yi Home Camera 27US 1.8.7.0D. A specially crafted 7-Zip file can cause a CRC collision, resulting in a firmware update and code execution. An attacker can insert an SDcard to trigger this vulnerability.","unknown","Yi Technology","Home"
"CVE-2024-35210","A vulnerability has been identified in SINEC Traffic Analyzer (6GK8822-1BG01-0BA0) (All versions < V1.2). The affected web server is not enforcing HSTS. This could allow an attacker to perform downgrade attacks exposing confidential information.","Siemens","SINEC Traffic Analyzer","SCADA"
"CVE-2025-63958","MILLENSYS Vision Tools Workspace 6.5.0.2585 exposes a sensitive configuration endpoint (/MILLENSYS/settings) that is accessible without authentication. This page leaks plaintext database credentials, file share paths, internal license server configuration, and software update parameters. An unauthenticated attacker can retrieve this information by accessing the endpoint directly, potentially leading to full system compromise. The vulnerability is due to missing access controls on a privileged administrative function.","n/a","n/a","PC"
"CVE-2022-31481","An unauthenticated attacker can send a specially crafted update file to the device that can overflow a buffer. This vulnerability impacts products based on HID Mercury Intelligent Controllers LP1501, LP1502, LP2500, LP4502, and EP4502 which contain firmware versions prior to 1.302 for the LP series and 1.296 for the EP series. The overflowed data can allow the attacker to manipulate the “normal” code execution to that of their choosing. An attacker with this level of access on the device can monitor all communications sent to and from this device, modify onboard relays, change configuration files, or cause the device to become unstable.","LenelS2","LNL-X2210","SCADA"
"CVE-2025-34071","A remote code execution vulnerability in GFI Kerio Control 9.4.5 allows attackers with administrative access to upload and execute arbitrary code through the firmware upgrade feature. The system upgrade mechanism accepts unsigned .img files, which can be modified to include malicious scripts within the upgrade.sh or disk image components. These modified upgrade images are not validated for authenticity or integrity, and are executed by the system post-upload, enabling root access.","GFI Software","Kerio Control","Other"
"CVE-2020-0867","An elevation of privilege vulnerability exists when the Windows Update Orchestrator Service improperly handles file operations, aka 'Windows Update Orchestrator Service Elevation of Privilege Vulnerability'. This CVE ID is unique from CVE-2020-0868.","Microsoft","Windows","PC"
"CVE-2017-14090","A vulnerability in Trend Micro ScanMail for Exchange 12.0 exists in which some communications to the update servers are not encrypted.","Trend Micro","Trend Micro ScanMail for Exchange","Other"
"CVE-2022-29173","go-tuf is a Go implementation of The Update Framework (TUF). go-tuf does not correctly implement the client workflow for updating the metadata files for roles other than the root role. Specifically, checks for rollback attacks are not implemented correctly meaning an attacker can cause clients to install software that is older than the software which the client previously knew to be available, and may include software with known vulnerabilities. In more detail, the client code of go-tuf has several issues in regards to preventing rollback attacks: 1. It does not take into account the content of any previously trusted metadata, if available, before proceeding with updating roles other than the root role (i.e., steps 5.4.3.1 and 5.5.5 of the detailed client workflow). This means that any form of version verification done on the newly-downloaded metadata is made using the default value of zero, which always passes. 2. For both timestamp and snapshot roles, go-tuf saves these metadata files as trusted before verifying if the version of the metafiles they refer to is correct (i.e., steps 5.5.4 and 5.6.4 of the detailed client workflow). A fix is available in version 0.3.0 or newer. No workarounds are known for this issue apart from upgrading.","theupdateframework","go-tuf","Home"
"CVE-2018-3833","An exploitable firmware downgrade vulnerability exists in Insteon Hub running firmware version 1013. The firmware upgrade functionality, triggered via PubNub, retrieves signed firmware binaries using plain HTTP requests. The device doesn't check the firmware version that is going to be installed and thus allows for flashing older firmware images. To trigger this vulnerability, an attacker needs to impersonate the remote server 'cache.insteon.com' and serve any signed firmware image.","Insteon","Insteon","Other"
"CVE-2025-29989","Dell Client Platform BIOS contains a Security Version Number Mutable to Older Versions vulnerability. A high privileged attacker with local access could potentially exploit this vulnerability, leading to BIOS upgrade denial.","Dell","Dell Client Platform BIOS","PC"
"CVE-2025-36582","Dell NetWorker, versions 19.12.0.1 and prior, contains a Selection of Less-Secure Algorithm During Negotiation ('Algorithm Downgrade') vulnerability. An unauthenticated attacker with remote access could potentially exploit this vulnerability, leading to Information disclosure.","Dell","NetWorker","Enterprise"
"CVE-2025-12295","A weakness has been identified in D-Link DAP-2695 2.00RC13. The affected element is the function sub_40C6B8 of the component Firmware Update Handler. Executing manipulation can lead to improper verification of cryptographic signature. The attack can be launched remotely. Attacks of this nature are highly complex. The exploitability is described as difficult. The exploit has been made available to the public and could be exploited. This vulnerability only affects products that are no longer supported by the maintainer.","D-Link","DAP-2695","Home"
"CVE-2022-3913","Rapid7 Nexpose and InsightVM versions 6.6.82 through 6.6.177 fail to validate the certificate of the update server when downloading updates. This failure could allow an attacker in a privileged position on the network to provide their own HTTPS endpoint, or intercept communications to the legitimate endpoint. The attacker would need some pre-existing access to at least one node on the network path between the Rapid7-controlled update server and the Nexpose/InsightVM application, and the ability to either spoof the update server's FQDN or redirect legitimate traffic to the attacker's server in order to exploit this vulnerability. Note that even in this scenario, an attacker could not normally replace an update package with a malicious package, since the update process validates a separate, code-signing certificate, distinct from the HTTPS certificate used for communication. This issue was resolved on February 1, 2023 in update 6.6.178 of Nexpose and InsightVM. ","Rapid7","Nexpose","Other"
"CVE-2019-14707","An issue was discovered on MicroDigital N-series cameras with firmware through 6400.0.8.5. The firmware update process is insecure, leading to remote code execution. The attacker can provide arbitrary firmware in a .dat file via a webparam?system&action=set&upgrade URI.","n/a","n/a","Other"
"CVE-2023-4052","The Firefox updater created a directory writable by non-privileged users. When uninstalling Firefox, any files in that directory would be recursively deleted with the permissions of the uninstalling user account. This could be combined with creation of a junction (a form of symbolic link) to allow arbitrary file deletion controlled by the non-privileged user. *This bug only affects Firefox on Windows. Other operating systems are unaffected.* This vulnerability affects Firefox < 116, Firefox ESR < 115.1, and Thunderbird < 115.1.","Mozilla","Firefox","PC"
"CVE-2018-14903","EPSON WF-2750 printers with firmware JP02I2 do not properly validate files before running updates, which allows remote attackers to cause a printer malfunction or send malicious data to the printer.","n/a","n/a","Other"
"CVE-2020-27488","Loxone Miniserver devices with firmware before 11.1 (aka 11.1.9.3) are unable to use an authentication method that is based on the ""signature of the update package."" Therefore, these devices (or attackers who are spoofing these devices) can continue to use an unauthenticated cloud service for an indeterminate time period (possibly forever). Once an individual device's firmware is updated, and authentication occurs once, the cloud service recategorizes the device so that authentication is subsequently always required, and spoofing cannot occur.","n/a","n/a","Enterprise"
"CVE-2024-29916","The dormakaba Saflok system before the November 2023 software update allows an attacker to unlock arbitrary doors at a property via forged keycards, if the attacker has obtained one active or expired keycard for the specific property, aka the ""Unsaflok"" issue. This occurs, in part, because the key derivation function relies only on a UID. This affects, for example, Saflok MT, and the Confidant, Quantum, RT, and Saffire series.","n/a","n/a","Other"
"CVE-2021-30110","dttray.exe in Greyware Automation Products Inc Domain Time II before 5.2.b.20210331 allows remote attackers to execute arbitrary code via a URL to a malicious update in a spoofed response to the UDP query used to check for updates.","n/a","n/a","Other"
"CVE-2019-10940","A vulnerability has been identified in SINEMA Server (All versions < V14.0 SP2 Update 1). Incorrect session validation could allow an attacker with a valid session, with low privileges, to perform firmware updates and other administrative operations on connected devices. The security vulnerability could be exploited by an attacker with network access to the affected system. An attacker must have access to a low privileged account in order to exploit the vulnerability. An attacker could use the vulnerability to compromise confidentiality, integrity, and availability of the affected system and underlying components. At the time of advisory publication no public exploitation of this security vulnerability was known.","Siemens AG","SINEMA Server","PC"
"CVE-2021-40847","The update process of the Circle Parental Control Service on various NETGEAR routers allows remote attackers to achieve remote code execution as root via a MitM attack. While the parental controls themselves are not enabled by default on the routers, the Circle update daemon, circled, is enabled by default. This daemon connects to Circle and NETGEAR to obtain version information and updates to the circled daemon and its filtering database. However, database updates from NETGEAR are unsigned and downloaded via cleartext HTTP. As such, an attacker with the ability to perform a MitM attack on the device can respond to circled update requests with a crafted, compressed database file, the extraction of which gives the attacker the ability to overwrite executable files with attacker-controlled code. This affects R6400v2 1.0.4.106, R6700 1.0.2.16, R6700v3 1.0.4.106, R6900 1.0.2.16, R6900P 1.3.2.134, R7000 1.0.11.123, R7000P 1.3.2.134, R7850 1.0.5.68, R7900 1.0.4.38, R8000 1.0.4.68, and RS400 1.5.0.68.","n/a","n/a","Home"
"CVE-2023-20178","A vulnerability in the client update process of Cisco AnyConnect Secure Mobility Client Software for Windows and Cisco Secure Client Software for Windows could allow a low-privileged, authenticated, local attacker to elevate privileges to those of SYSTEM. The client update process is executed after a successful VPN connection is established. This vulnerability exists because improper permissions are assigned to a temporary directory that is created during the update process. An attacker could exploit this vulnerability by abusing a specific function of the Windows installer process. A successful exploit could allow the attacker to execute code with SYSTEM privileges.","Cisco","Cisco Secure Client","Enterprise"
"CVE-2020-25233","A vulnerability has been identified in LOGO! 8 BM (incl. SIPLUS variants) (All versions < V8.3). The firmware update of affected devices contains the private RSA key that is used as a basis for encryption of communication with the device.","Siemens","LOGO! 8 BM (incl. SIPLUS variants)","SCADA"
"CVE-2022-27229","Path transversal in some Intel(R) NUC Kits NUC7i3DN, NUC7i5DN, NUC7i7DN HDMI firmware update tool software before version 1.79.1.1 may allow an authenticated user to potentially enable escalation of privilege via local access.","n/a","Intel(R) NUC Kits NUC7i3DN, NUC7i5DN, NUC7i7DN HDMI firmware update tool software","Other"
"CVE-2023-30559","The firmware update package for the wireless card is not properly signed and can be modified.","Becton Dickinson & Co ","BD Alaris™ Point-of-Care Unit (PCU) Model 8015","PC"
"CVE-2019-12574","A vulnerability in the London Trust Media Private Internet Access (PIA) VPN Client v1.0 for Windows could allow an authenticated, local attacker to run arbitrary code with elevated privileges. The PIA client is vulnerable to a DLL injection vulnerability during the software update process. The updater loads several libraries from a folder that authenticated users have write access to. A low privileged user can leverage this vulnerability to execute arbitrary code as SYSTEM.","n/a","n/a","Enterprise"
"CVE-2017-17668","Memory write mechanism in NCR S1 Dispenser controller before firmware version 0x0156 allows an unauthenticated user to upgrade or downgrade the firmware of the device, including to older versions with known vulnerabilities.","n/a","n/a","Other"
"CVE-2021-40507","An issue was discovered in the ALU unit of the OR1200 (aka OpenRISC 1200) processor 2011-09-10 through 2015-11-11. The overflow flag is not being updated correctly for the subtract instruction, which results in an incorrect value in the overflow flag. Any software that relies on this flag may experience corruption in execution.","n/a","n/a","Other"
"CVE-2019-12288","An issue was discovered in upgrade_htmls.cgi on VStarcam 100T (C7824WIP) KR75.8.53.20 and 200V (C38S) KR203.18.1.20 devices. The web service, network, and account files can be manipulated through a web UI firmware update without any authentication. The attacker can achieve access to the device through a manipulated web UI firmware update.","n/a","n/a","Other"
"CVE-2022-46434","An issue in the firmware update process of TP-Link TL-WA7510N v1 v3.12.6 and earlier allows attackers to execute arbitrary code or cause a Denial of Service (DoS) via uploading a crafted firmware image.","n/a","n/a","Home"
"CVE-2022-32252","A vulnerability has been identified in SINEMA Remote Connect Server (All versions < V3.1). The application does not perform the integrity check of the update packages. Without validation, an admin user might be tricked to install a malicious package, granting root privileges to an attacker.","Siemens","SINEMA Remote Connect Server","SCADA"
"CVE-2023-35721","NETGEAR Multiple Routers curl_post Improper Certificate Validation Remote Code Execution Vulnerability. This vulnerability allows network-adjacent attackers to compromise the integrity of downloaded information on affected installations of multiple NETGEAR routers. Authentication is not required to exploit this vulnerability. The specific flaw exists within the update functionality, which operates over HTTPS. The issue results from the lack of proper validation of the certificate presented by the server. An attacker can leverage this in conjunction with other vulnerabilities to execute arbitrary code in the context of root. Was ZDI-CAN-19981.","NETGEAR","Multiple Routers","Home"
"CVE-2024-44231","This issue was addressed through improved state management. This issue is fixed in macOS Sequoia 15.1. A person with physical access to a Mac may be able to bypass Login Window during a software update.","Apple","macOS","PC"
"CVE-2022-22374","The BMC (IBM Power 9 AC922 OP910, OP920, OP930, and OP940) may be subject to a firmware downgrade attack which may affect its ability to operate its host. IBM X-Force ID: 221442.","IBM","Power 9 AC922","Enterprise"
"CVE-2018-7799","A DLL hijacking vulnerability exists in Schneider Electric Software Update (SESU), all versions prior to V2.2.0, which could allow an attacker to execute arbitrary code on the targeted system when placing a specific DLL file.","Schneider Electric SE","Schneider Electric Software Update (SESU), all versions prior to V2.2.0","SCADA"
"CVE-2023-24454","Jenkins TestQuality Updater Plugin 1.3 and earlier stores the TestQuality Updater password unencrypted in its global configuration file on the Jenkins controller where it can be viewed by users with access to the Jenkins controller file system.","Jenkins Project","Jenkins TestQuality Updater Plugin","Home"
"CVE-2023-36650","A missing integrity check in the update system in ProLion CryptoSpike 3.0.15P2 allows attackers to execute OS commands as the root Linux user on the host system via forged update packages.","n/a","n/a","PC"
"CVE-2021-37127","There is a signature management vulnerability in some huawei products. An attacker can forge signature and bypass the signature check. During firmware update process, successful exploit this vulnerability can cause the forged system file overwrite the correct system file. Affected product versions include:iManager NetEco V600R010C00CP2001,V600R010C00CP2002,V600R010C00SPC100,V600R010C00SPC110,V600R010C00SPC120,V600R010C00SPC200,V600R010C00SPC210,V600R010C00SPC300;iManager NetEco 6000 V600R009C00SPC100,V600R009C00SPC110,V600R009C00SPC120,V600R009C00SPC190,V600R009C00SPC200,V600R009C00SPC201,V600R009C00SPC202,V600R009C00SPC210.","n/a","iManager NetEco;iManager NetEco 6000","Other"
"CVE-2022-48359","The recovery mode for updates has a vulnerability that causes arbitrary disk modification. Successful exploitation of this vulnerability may affect confidentiality.","Huawei","HarmonyOS","Enterprise"
"CVE-2022-36344","An unquoted search path vulnerability exists in 'JustSystems JUST Online Update for J-License' bundled with multiple products for corporate users as in Ichitaro through Pro5 and others. Since the affected product starts another program with an unquoted file path, a malicious file may be executed with the privilege of the Windows service if it is placed in a certain path. Affected products are bundled with the following product series: Office and Office Integrated Software, ATOK, Hanako, JUST PDF, Shuriken, Homepage Builder, JUST School, JUST Smile Class, JUST Smile, JUST Frontier, JUST Jump, and Tri-De DetaProtect.","JustSystems Corporation","JustSystems JUST Online Update for J-License'","PC"
"CVE-2018-3832","An exploitable firmware update vulnerability exists in Insteon Hub running firmware version 1013. The HTTP server allows for uploading arbitrary MPFS binaries that could be modified to enable access to hidden resources which allow for uploading unsigned firmware images to the device. To trigger this vulnerability, an attacker can upload an MPFS binary via the '/mpfsupload' HTTP form and later on upload the firmware via a POST request to 'firmware.htm'.","Insteon","Insteon","Other"
"CVE-2024-48770","An issue in Plug n Play Camera com.wisdomcity.zwave 1.1.0 allows a remote attacker to obtain sensitive information via the firmware update process.","n/a","n/a","Home"
"CVE-2018-3891","An exploitable firmware downgrade vulnerability exists in the firmware update functionality of Yi Home Camera 27US 1.8.7.0D. A specially crafted file can cause a logic flaw, resulting in a firmware downgrade. An attacker can insert an SD card to trigger this vulnerability.","unknown","Yi Technology","Home"
"CVE-2020-7743","The package mathjs before 7.5.1 are vulnerable to Prototype Pollution via the deepExtend function that runs upon configuration updates.","n/a","mathjs","Other"
"CVE-2020-27540","Bash injection vulnerability and bypass of signature verification in Rostelecom CS-C2SHW 5.0.082.1. The camera reads firmware update configuration from SD card file vc\version.json. fw-sign parameter and from this configuration is directly inserted into a bash command. Firmware update is run automatically if there is special file on the inserted SD card.","n/a","n/a","PC"
"CVE-2016-5253","The Updater in Mozilla Firefox before 48.0 on Windows allows local users to write to arbitrary files via vectors involving the callback application-path parameter and a hard link.","n/a","n/a","PC"
"CVE-2024-40848","A downgrade issue was addressed with additional code-signing restrictions. This issue is fixed in macOS Ventura 13.7, macOS Sonoma 14.7, macOS Sequoia 15. An attacker may be able to read sensitive information.","Apple","macOS","PC"
"CVE-2020-10926","This vulnerability allows network-adjacent attackers to execute arbitrary code on affected installations of NETGEAR R6700 V1.0.4.84_10.0.58 routers. Authentication is not required to exploit this vulnerability. The specific flaw exists within the handling of firmware updates. The issue results from the lack of proper validation of the firmware image prior to performing an upgrade. An attacker can leverage this in conjunction with other vulnerabilities to execute code in the context of root. Was ZDI-CAN-9648.","NETGEAR","R6700","Home"
"CVE-2024-48793","An issue in INATRONIC com.inatronic.bmw 2.7.1 allows a remote attacker to obtain sensitive information via the firmware update process.","n/a","n/a","Other"
"CVE-2020-25166","An improper verification of the cryptographic signature of firmware updates of the B. Braun Melsungen AG SpaceCom Version L81/U61 and earlier, and the Data module compactplus Versions A10 and A11 allows attackers to generate valid firmware updates with arbitrary content that can be used to tamper with devices.","B. Braun Melsungen AG","SpaceCom","SCADA"
"CVE-2018-7298","In /usr/local/etc/config/addons/mh/loopupd.sh on eQ-3 AG HomeMatic CCU2 2.29.22 devices, software update packages are downloaded via the HTTP protocol, which does not provide any cryptographic protection of the downloaded contents. An attacker with a privileged network position (which could be obtained via DNS spoofing of www.meine-homematic.de or other approaches) can exploit this issue in order to provide arbitrary malicious firmware updates to the CCU2. This can result in a full system compromise.","n/a","n/a","Other"
"CVE-2020-15838","The Agent Update System in ConnectWise Automate before 2020.8 allows Privilege Escalation because the _LTUPDATE folder has weak permissions.","n/a","n/a","Other"
"CVE-2023-37541","HCL Connections contains a broken access control vulnerability that may allow unauthorized user to update data in certain scenarios.","HCL Software","Connections","Other"
"CVE-2024-28809","An issue was discovered in Infinera hiT 7300 5.60.50. Cleartext storage of sensitive password in firmware update packages allows attackers to access various appliance services via hardcoded credentials.","n/a","n/a","Enterprise"
